{
  "$schema": "./schemas/registry.schema.json",
  "schemaVersion": 1,
  "affectedAreas": ["api", "web", "shared", "workflow", "documentation", "release", "migration"],
  "riskTags": ["authentication", "authorization", "billing", "money", "migration", "release", "offline", "realtime", "localization", "responsive", "deployment", "workflow"],
  "profiles": [
    { "id": "web", "guidePath": "profiles/web.md", "compatibleAffectedAreas": ["web", "documentation"], "supportedRiskTags": ["authentication", "authorization", "billing", "money", "offline", "realtime", "localization", "responsive"] },
    { "id": "api", "guidePath": "profiles/api.md", "compatibleAffectedAreas": ["api", "documentation"], "supportedRiskTags": ["authentication", "authorization", "billing", "money", "offline", "realtime"] },
    { "id": "contracts", "guidePath": "profiles/contracts.md", "compatibleAffectedAreas": ["shared", "api", "web", "documentation"], "supportedRiskTags": ["authentication", "authorization", "billing", "money", "offline", "realtime", "localization"] },
    { "id": "data-integrity", "guidePath": "profiles/data-integrity.md", "compatibleAffectedAreas": ["api", "web", "shared", "migration", "release", "documentation"], "supportedRiskTags": ["authentication", "authorization", "billing", "money", "migration", "release", "offline", "realtime"] },
    { "id": "behavior-tests", "guidePath": "profiles/behavior-tests.md", "compatibleAffectedAreas": ["web", "api", "shared", "documentation"], "supportedRiskTags": ["authentication", "authorization", "billing", "money", "offline", "realtime", "localization", "responsive"] },
    { "id": "ops-workflow", "guidePath": "profiles/ops-workflow.md", "compatibleAffectedAreas": ["workflow", "release", "documentation"], "supportedRiskTags": ["migration", "release", "deployment", "workflow"] }
  ],
  "reviewers": [
    { "id": "behavior_mapper", "phase": "planning", "readOnly": true, "nonDelegating": true, "githubWrites": false, "headBinding": "reviewed", "guidance": "Map relevant feature and scenario IDs, tags, existing steps, exact targeted commands, and browser projects; report missing specifications, selectors, or unresolved selection uncertainty." },
    { "id": "security_reviewer", "phase": "review", "readOnly": true, "nonDelegating": true, "githubWrites": false, "headBinding": "integrated", "guidance": "Review cookie flags, session lifecycle, authorization boundaries, capability replay and rotation, rate limits, idempotency, and token or identity leakage." },
    { "id": "offline_realtime_reviewer", "phase": "review", "readOnly": true, "nonDelegating": true, "githubWrites": false, "headBinding": "integrated", "guidance": "Review identity-partitioned storage, mutation UUID replay, conflict quarantine, online-only boundaries, SSE ordering and cursor safety, session revalidation, refetch, cache clearing, and revocation." },
    { "id": "integration_verifier", "phase": "review", "readOnly": true, "nonDelegating": true, "githubWrites": false, "headBinding": "integrated", "guidance": "Perform the final combined-change review with task profiles, risks, specialist evidence, targeted validation, ownership, and reviewed and integrated commits; reject missing or stale required evidence." }
  ],
  "routing": {
    "behaviorMapper": { "specializations": ["behavior-tests"], "riskTags": ["localization", "responsive"], "signals": ["browserVisible", "testSelectionUncertain"] },
    "securityReviewerRiskTags": ["authentication", "authorization"],
    "offlineRealtimeReviewerRiskTags": ["offline", "realtime"],
    "dataIntegrityGuidanceRiskTags": ["billing", "money", "migration", "release"],
    "opsWorkflowGuidanceRiskTags": ["deployment", "workflow"],
    "integrationVerifierHighPriorityRiskTags": ["billing", "money", "migration", "release"]
  }
}
